{
  "api_version": "1.0",
  "id": "shared.research",
  "version": "2.2.0",
  "display_name": "专题研究",
  "description": "将研究问题拆解为有边界的并行检索，并形成可追溯结论。",
  "category": "shared",
  "permissions": ["knowledge.read", "knowledge.write", "web.read", "artifact.write"],
  "dependencies": [{"id": "shared.knowledge", "version": ">=1.0.0"}],
  "skills": ["research-frontier-markets"],
  "workflows": [
    "workflows/frontier-research.json",
    "workflows/frontier-research-subagent.json",
    "workflows/frontier-readonly-v2.json",
    "workflows/pdf-import.json"
  ]
}
