{
  "api_version": "1.0",
  "id": "product.release",
  "version": "1.0.0",
  "display_name": "发布与复盘",
  "description": "检查发布条件、风险、回滚路径和发布后的指标闭环。",
  "category": "product",
  "permissions": ["knowledge.read", "knowledge.write", "artifact.write"],
  "dependencies": [
    {"id": "shared.knowledge", "version": ">=1.0.0"},
    {"id": "product.requirements", "version": ">=1.0.0"}
  ],
  "skills": ["review-product-release"],
  "workflows": ["workflows/release-review.json"]
}
