{
  "api_version": "1.0",
  "id": "shared.weekly-report",
  "version": "1.2.0",
  "display_name": "周报与汇报",
  "description": "汇总本周事实、风险和下周动作，生成经人工确认的周报演示文稿。",
  "category": "shared",
  "permissions": ["knowledge.read", "sales.read", "task.audit.read", "artifact.read", "presentation.plan.write", "artifact.write"],
  "dependencies": [
    {"id": "shared.knowledge", "version": ">=1.0.0"},
    {"id": "shared.documents", "version": ">=1.0.0"},
    {"id": "shared.presentation-studio", "version": ">=1.0.0"}
  ],
  "skills": ["build-director-decks", "plan-director-presentations"],
  "workflows": ["workflows/weekly-deck.json", "workflows/weekly-deck-v2.json"]
}
