{
  "api_version": "1.0",
  "id": "market.government",
  "version": "1.1.0",
  "display_name": "政府合作方案",
  "description": "依据地方条件、公开政策和企业能力形成可核验的合作方案。",
  "category": "market",
  "permissions": ["knowledge.read", "web.read", "artifact.write"],
  "dependencies": [
    {"id": "shared.knowledge", "version": ">=1.0.0"},
    {"id": "shared.research", "version": ">=2.0.0"},
    {"id": "shared.documents", "version": ">=1.0.0"},
    {"id": "shared.weekly-report", "version": ">=1.0.0"}
  ],
  "skills": ["draft-government-program"],
  "workflows": ["workflows/government-proposal.json"]
}
